{"schema_version":1,"scenario_id":"base-lsm-write","pair_id":"base-lsm-write","seed":704,"engine":"lsm","workload":{"kind":"write","initial_records":40,"operations":80,"keyspace":100,"value_bytes":48,"read_pct":15,"write_pct":75,"scan_pct":10,"delete_pct":0,"distribution":"uniform","range_width":8,"negative_read_pct":10},"engine_config":{"page_size":1024,"cache_pages":12,"memtable_entries":8,"bloom_bits_per_key":8,"compaction_threshold":4,"compaction_enabled":true,"max_runs":8,"sparse_stride":4},"comparison_variable":"base workload"}
