{"schema_version":1,"scenario_id":"f02-compaction-repaired","pair_id":"f02-compaction","seed":712,"engine":"lsm","workload":{"kind":"write","initial_records":30,"operations":100,"keyspace":100,"value_bytes":48,"read_pct":10,"write_pct":85,"scan_pct":5,"delete_pct":0,"distribution":"uniform","range_width":8,"negative_read_pct":10},"engine_config":{"page_size":1024,"cache_pages":8,"memtable_entries":4,"bloom_bits_per_key":8,"compaction_threshold":3,"compaction_enabled":true,"max_runs":6,"sparse_stride":4},"comparison_variable":"compaction_enabled"}
