{"schema_version":1,"scenario_id":"f04-runs-repaired","pair_id":"f04-runs","seed":714,"engine":"lsm","workload":{"kind":"range","initial_records":40,"operations":100,"keyspace":90,"value_bytes":48,"read_pct":10,"write_pct":40,"scan_pct":50,"delete_pct":0,"distribution":"uniform","range_width":20,"negative_read_pct":0},"engine_config":{"page_size":1024,"cache_pages":8,"memtable_entries":4,"bloom_bits_per_key":8,"compaction_threshold":3,"compaction_enabled":true,"max_runs":20,"sparse_stride":4},"comparison_variable":"compaction_enabled"}
