{"schema_version":1,"scenario_id":"f06-tombstone-repaired","pair_id":"f06-tombstone","seed":716,"engine":"lsm","workload":{"kind":"delete","initial_records":50,"operations":100,"keyspace":60,"value_bytes":48,"read_pct":15,"write_pct":10,"scan_pct":15,"delete_pct":60,"distribution":"uniform","range_width":12,"negative_read_pct":20},"engine_config":{"page_size":1024,"cache_pages":8,"memtable_entries":4,"bloom_bits_per_key":8,"compaction_threshold":3,"compaction_enabled":true,"max_runs":20,"sparse_stride":4},"comparison_variable":"compaction_enabled"}
