{"schema_version":1,"scenario_id":"f05-skew-cache-repaired","pair_id":"f05-skew-cache","seed":715,"engine":"btree","workload":{"kind":"skew","initial_records":50,"operations":100,"keyspace":80,"value_bytes":48,"read_pct":50,"write_pct":40,"scan_pct":10,"delete_pct":0,"distribution":"hot","range_width":10,"negative_read_pct":5},"engine_config":{"page_size":1024,"cache_pages":12,"memtable_entries":8,"bloom_bits_per_key":8,"compaction_threshold":4,"compaction_enabled":true,"max_runs":8,"sparse_stride":4},"comparison_variable":"cache_pages"}
