{"schema_version":1,"scenario_id":"f01-cache-repaired","pair_id":"f01-cache","seed":711,"engine":"btree","workload":{"kind":"read","initial_records":50,"operations":100,"keyspace":70,"value_bytes":48,"read_pct":85,"write_pct":5,"scan_pct":10,"delete_pct":0,"distribution":"hot","range_width":12,"negative_read_pct":10},"engine_config":{"page_size":1024,"cache_pages":16,"memtable_entries":8,"bloom_bits_per_key":8,"compaction_threshold":4,"compaction_enabled":true,"max_runs":8,"sparse_stride":4},"comparison_variable":"cache_pages"}
